id,question,A,B,C,D,answer
int32,string,string,string,string,string,string
0,当采用分块查找时，数据的组织方式为____,数据分成若干块， 每块内数据有序,数据分成若干块， 每块内数据不必有序， 但块间必须有序， 每块内最大（ 或最小） 的数据组成索引块,数据分成若干块， 每块内数据有序， 但块间必须有序， 每块内最大（ 或最小） 的数据组成索引块,数据分成若干块， 每块（ 除最后一块外） 中数据个数需相同,B
1,实现一个银行系统，包括存钱、取钱、转账等多项业务，最恰当的资源组合方式是____,继承,重载,组合,实例化,C
2,"#include<iostream.h> class date { private: int day,month,year; public: date(){} date(int x,int y,int z){day=x;month=y,year=z;} void set(){day=1;month=10;year=2002;} void display(){cout<<day<<""/""<<month<<""/""<<year<<"""";} }; void main() { date day1; date day2(10,10,2002); day1.set(); day1.display(); day2.display(); } 上面C++程序运行的结果是____。",10/10/2002 1/10/2002,1/10/2002 10/10/2002,10/10/2002 10/10/2002,1/10/2002 1/10/2002,B
3,假定A是一个类的名字，下面四个语句总共会引发类A构造函数的调用多少次____ ①A *p=newA; ②A p2[10]; ③A p3; ④A *p4[10];,11,12,21,22,B
4,"有以下程序代码 #include<iostream> using namespace std; class integer{ public: integer(int value=0):value(value){} integer operator+(integer itg){ return value+=itg.value; } friend ostream&operator<<(ostream&os,integer&it){ return os<<it.value; } private: int value; }; int main() { integer i; integer ii; ii=2+i; cout<<""i=""<<i<<"",""; cout<<""ii=""<<ii<<endl; return 0; } 编译情况或运行时输出是____","i=0 ,ii=2","i=2 ,ii=2","i=0 ,ii=0",编译错误,D
5,在以下各种查找方法中，平均查找时间与结点个数无关的查找方法是____,顺序查找,折半查找,哈希查找,分块查找,C
6,"读下面C++程序： #include<iostream.h> class vehicle{ protected: int wheels; public: vehicle(int in_wheels=4){wheels=in_wheels;} int get_wheels(){return wheels;} }; void main() { vehicle unicyclel; vehicle unicycle2(3); cout<<""Theunickele1has""<<unicyclel.get_wheels()<<""wheel.\n""; cout<<""Theunickele2has""<<unicycle2.get_wheels()<<""wheel.\n""; } 编译后输出结果为____。",The unicycle1 has 0 wheel. The unicycle2 has 3 wheel.,The unicycle1 has 4 wheel. The unicycle2 has 4 wheel.,The unicycle1 has 4 wheel. The unicycle2 has 3 wheel.,The unicycle1 has 0 wheel. The unicycle2 has 4 wheel.,C
7,以下说法正确的是____,在const成员函数中不可以使用this指针；,在static成员函数中不可以使用this 指针；,抽象类的成员函数都是纯虚函数；,抽象类的派生类必须实现抽象类中的纯虚函数。,B
8,一个n个顶点的连通无向图，其边的个数至少为____,n-1,n,n+1,nlogn,A
9,在C++程序中出现____情况时，将引发一个异常。,在 main 函数的结尾少了一个大括号,for 循环语法错误,被零除或数组溢出,数组没有被赋满值,C
10,线性表若采用链式存储结构时，要求内存中可用存储单元的地址____。,必须是连续的,部分地址必须是连续的,一定是不连续的,连续不连续都可以,D
11,在类中说明的友元函数时____,必须声明在私有成员部分,必须声明在共有成员部分,必须声明在类开始处,可以声明在类中任何地方,D
12,对有14个元素的有序表A[1..14]作二分查找，查找元素A[6]时的被比较元素依次为____,"A[l], A[2], A[3], A[4]","A[l], A[14], A[7], A[4]","A[7], A[5], A[3], A[6]","A[7], A[3], A[5], A[6]",D
13,下列概念____体现了面向对象的多态性。,虚基类,虚函数,对象容器,封装,B
14,"若有定义char s[]={'1','2','3','0','0','4','5'};则cout<<s的结果为____",1230045,12300,1230,123,C
15,在C++中，数据封装要解决的问题是____。,数据规范化排列,数据高速转换,避免数据丢失,保证数据完整性,D
16,在顺序表（长度为127）中插入一个元素平均要移动____个元素。,8,63.5,63,7,B
17,关于左值引用，下列用法或叙述不正确的是____,引用可以先定义，再赋值；,引用可以作为函数参数；,函数可以返回引用；,引用是另一个有名字变量的别名。,A
18,"现今的软件或是操作系统往往都有32位和64位的不同的版本，主要的区别就是32位的应用程序中，使用32个二进制位（即4字节）来表示内存地址，64位软件则是用64个二进制位表示内存地址。于是，当我们在将一个程序编译为64位的程序时，有下列语句 cout<<sizeof(int)<<""""<<sizeof(int*)<<""""; cout<<sizeof(double)<<""""<<sizeof(double*)<<endl; 其输出会是____;",4 4 8 8,4 4 8 4,4 8 8 8,4 8 4 8,C
19,下述哪一条是顺序存储结构的优点？____,存储密度大,插入运算方便,删除运算方便,可方便地用于各种逻辑结构的存储表示,A
20,将一棵有100个结点的完全二叉树从根这一层开始，每一层上从左到右依次对结点进行编号，根结点的编号为1，则编号为49的结点的左孩子编号为____。,98,99,50,48,A
21,下面哪种数据结构最适合用于创建一个优先级队列？____,栈,双向链表,单向链表,堆,D
22,关于多态性，下列说法错误的是____,C++语言的多态性分为编译时的多态性和运行时的多态性；,运行时的多态性可通过虚函数和函数重载实现；,编译时的多态性可通过模板实现；,实现运行时多态性的机制称为动态多态性。,B
23,关于构造函数，下列说法错误的是____,构造函数必须指定类型说明；,构造函数的函数名与类名相同；,构造函数可以设置缺省参数；,构造函数可以重载。,A
24,对于栈操作数据的原则是____。,先进先出,后进先出,后进后出,不分顺序,B
25,设栈S和队Q的初始状态均为空，元素abcdef依次通过栈S，一个元素出栈后即进队Q，若6个元素出栈的序列是cefdba，则栈S的容量至少应该是____,6,4,3,2,B
26,下面关于模版说法正确的是____。,类模版提供了一种对类中类型进行参数化的方法; 在实例化模版类时，实际的数据类型会代替与类成员或方法相关联的类型参数,类模版中必须包含类成员与类方法,不可以用自定义的数据类型实例化一个模版类,类模版中类方法的参数必须用占位符替代，而不能使用实际数据类型,A
27,现有一棵无重复关键字的AVL树，对其进行中序遍历可得到一个降序序列。下列关于该AVL树的叙述中，正确的是：____,根结点的度一定为 2,树中最小元素一定是叶结点,最后插入的元素一定是叶结点,树中最大元素一定是无左子树,D
28,计算算法的时间复杂度是属于一种____的方法。,事前统计,事前分析估算,事后统计,事后分析估算,B
29,假定AB为一个类，r2是AB类的对象，执行“AB r1=3;”时将自动调用该类的____,带一个整型参数的构造函数,无参构造函数,赋值运算符重载函数,拷贝构造函数,A
30,下列排序算法中，元素的移动次数与关键字的初始排列次序无关的是____,直接插入排序,冒泡排序,基数排序,快速排序,C
31,线性链表不具有的特点是____。,随机访问,不必事先估计所需存储空间大小,插入与删除时不必移动元素,所需空间与线性表长度成正比,A
32,设有一个递归算法如下： int fact(int n){ if(n<=0)return 1; else return n*fact(n-1); } 下面正确的叙述是____,计算fact(n)需要执行n次递归,fact(7)=5040,此递归算法最多只能计算到fact(8),以上结论都不对,B
33,"在C++中，一个函数为void f(int=1,char='a'),另一个函数为void f(int),则它们____。",不能在同一程序中定义,可以在同一程序中定义并可重载,可以在同一程序中定义，但不可重载,以上说法都不正确,B
34,已知一个有向图的邻接矩阵表示，要删除所有从第i个结点发出的边，应____。,将邻接矩阵的第i行删除,将邻接矩阵的第i行元素全部置为0,将邻接矩阵的第i列删除,将邻接矩阵的第i列元素全部置为0,B
35,"—组关键字序列A(12,14,3,16,8,7,10,17,5,11,9,6,13,15,4),为排成递增序利用堆排序的方法建立的初始的堆为____","（ 3， 4， 5, 8， 9， 7, 6, 17， 16， 14， 11， 12， 13， 15， 10 )","( 3， 5, 4, 8, 9， 7, 6， 17， 16， 14, 11， 12, 13， 15， 10 )","( 17, 16, 15, 14, 11, 13, 10, 12, 5, 8, 9, 6, 7， 3， 4 )","( 17, 16, 14, 15, 11, 13, 10, 12, 5, 8, 9, 6, 7, 3, 4 )",D
36,若一个线性表中最常用的操作是取第1个元素和我第1个元素的前趋元素，则采用____存储方式最节省时间。,顺序表,单链表,双链表,单循环链表,A
37,"已知全集为实数集$\mathbb{R}$，集合$A=\{x|x^{2}-2x<0\},B=\left\{x|l og_{2}x>0\right\}$，则$\left(\complement_R A \right) \cap B$的值为____","$\left(-\infty,0\right]\cup(1,+\infty)$","$\left(0,1\right]$","$\left[2,+\infty\right)$",$\emptyset$,C
38,抛物线$x^2=2y$的焦点坐标是____,"$(\frac{1}{4},0)$","$(0,\frac{1}{2})$","$(0,\frac{1}{4})$","$(\frac{1}{2},0)$",B
39,"$\forall x\neq0$,$\left(x+\frac{1}{x}\right)^{10}$可写成关于$\left(x^2+\frac{1}{x^2}\right)$的多项式，则该多项式各项系数之和为____",240,241,242,243,D
40,"过双曲线${\frac{x^{2}}{a^{2}}}-{\frac{y^{2}}{b^{2}}}=1(a>0,b>0)$的一个焦点F引它的渐近线的垂线，垂足为M，延长FM交y轴于E，若|FM|=2|ME|，则该双曲线的离心率为____",3,2,$\sqrt3$,$\sqrt2$,C
41,要得到函数$f(x)=\sin(2x+{\frac{\pi}{3}})$的导函数$f^{\prime}(x)$的图象，只需将$f(x)$的图像____,向左平移$\frac{\pi}{2}$个单位，再把各点的纵坐标伸长到原来的2倍（横坐标不变）,向左平移$\frac{\pi}{2}$个单位，再把各点的纵坐标缩短到原来的$\frac{1}{2}$倍（横坐标不变）,向右平移$\frac{\pi}{4}$个单位，再把各点的纵坐标伸长到原来的$\frac{1}{2}$倍（横坐标不变）,向右平移$\frac{\pi}{4}$个单位，再把各点的纵坐标伸长到原来的2倍（横坐标不变）,D
42,"在边长为3，4，5的三角形内部任取一点P,则点P到三个顶点距离都大于1的概率为____",$\frac{6-\pi}{6}$,$\frac{12-\pi}{12}$,$\frac{\pi}{6}$,$\frac{\pi}{12}$,B
43,椭圆$x^{2}+m y^{2}=1$的焦点在x轴上，长轴长是短轴长的两倍，则m的值为____,$\dfrac{1}{4}$,$\dfrac{1}{2}$,2,4,D
44,已知$\sin(\frac{\pi}{4}-x)=\frac{3}{5}$，则$\sin2x$的值为____,$\frac{19}{25}$,$\frac{16}{25}$,$\frac{14}{25}$,$\frac{7}{25}$,D
45,"已知函数$f(x)=a \ln x-2x$,若不等式$f(x+1)>a x-2e^{x}$在$x \in \left(0 +\infty\right)$上恒成立，则实数a的取值范围是____",$a{\leq}2$,$a\geq2$,$a{\leq}0$,$0\leq a\leq2$,A
46,17世纪，在研究天文学的过程中，为了简化大数运算，苏格兰数学家纳皮尔发明了对数，对数的思想方法即把乘方和乘法运算分别转化为乘法和加法，数学家拉普拉斯称赞为“对数的发明在实效上等于把天文学家的寿命延长了许多倍”.已知$\lg2\approx0.3010$，$\lg3\approx0.4771$，设$N=4^5\times27$，则N所在的区间为____,"$\left(10^{15},10^{16}\right)$","$\left(10^{16},10^{17}\right)$","$\left(10^{17},10^{18}\right)$","$\left(10^{18},10^{19}\right)$",C
47,为做好社区新冠疫情防控工作，需将五名志愿者分配到三个社区去开展工作，每名志愿者只分配到一个社区，每个社区至少分配一名志愿者，志愿者甲和乙必须去同一个社区，则不同的分配方法共有____,12种,18种,24种,36种,D
48,数学对于一个国家的发展至关重要，发达国家常常把保持数学领先地位作为他们的战略需求．现某大学为提高数学系学生的数学素养，特开设了“古今数学思想”“世界数学通史”“几何原本”“什么是数学”四门选修课程，要求数学系每位同学每学年至多选3门，大一到大三3学年必须将四门选修课程选完，则每位同学的不同选修方式有____,60种,78种,84种,144种,B
49,"若平面$\alpha$的法向量为$\vec{n}_{1}=(3,2,1)$，平面$\beta$的法向量为$\vec{n}_{2}=(2,0,-1)$则平面$\alpha$与平面$\beta$夹角的余弦值为____",$\frac{\sqrt{70}}{14}$,$\frac{\sqrt{70}}{10}$,$-\frac{\sqrt{70}}{14}$,$-\frac{\sqrt{70}}{10}$,A
50,已知$平面\alpha // 平面\beta$，$m\subset\alpha$，$n\subset\beta$，则下列结论一定正确是____,"m,n是平行直线","m,n是异面直线","m,n是共面直线","m,n是不相交直线",D
51,若抛物线$y^2=2px$的焦点与椭圆$\frac{x^2}{6}+\frac{y^2}{2}=1$的右焦点重合，则p的值为____,-2,2,-4,4,D
52,某一电子集成块有三个元件a，b，c并联构成，三个元件是否有故障相互独立．已知至少1个元件正常工作，该集成块就能正常运行．若每个元件能正常工作的概率均为$\frac{4}{5}$则在该集成块能够正常工作的情况下，有且仅有一个元件出现故障的概率为____,$\frac{12}{31}$,$\frac{48}{125}$,$\frac{16}{25}$,$\frac{16}{125}$,A
53,"已知条件$p:\left|x+1\right|>2$，条件$q:x>a$,且$\neg p$是$\neg q$的充分不必要条件，则实数a的取值范围是____",$a\geq1$,$a\leq1$,$a\geq-1$,$a\leq -3$,A
54,"已知函数$f(x)$是定义在$\mathbb{R}$上的偶函数，且在$\left(0,+\infty\right)$上单调递增，则____",$f(-3)<f(-\log_{3}13)<f(2^{0.6})$,$f(-3)<f(2^{0.6})<f(-\log_{3}13)$,$f(2^{0.6})< f(-\log_{3}13) <f(-3)$,$f(2^{0.6})<f(-3)< f(-\log_{3}13) $,C
55,下列关于法律推理的表述，能够成立的是____。,演绎推理是一种或然性推理,归纳推理是从一般知识推出个别知识的推理,类比推理是判例法国家运用的一种基本的法律推理方法,辩证推理实际上是一种立法活动,C
56,某住宅小区业主从事的下列行为中，不必将相关情况告知物业服务人的情形是____。,业主甲将其房屋出租给赵某,业主乙在其住宅上设立居住权供其弟居住,业主丙依法将建筑区划内的绿地改造成花园,业主丁在其住宅上设立地役权,D
57,张某在甲期刊社发表了一篇颇具价值的学术论文，但未作版权说明。乙期刊社将该学术论文作为资料刊登。则乙期刊社的行为____。,属于合理使用，不必向著作权人支付报酬,属于侵犯著作权的行为,不必经甲期刊社同意，但应向其支付报酬,不必经张某同意，但应向其支付报酬,D
58,关于我国宪法修改，下列哪一选项是正确的____。,我国修宪实践中既有对宪法的部分修改，也有对宪法的全面修改,经1/10以上的全国人大代表提议，可以启动宪法修改程序,全国人大常委会是法定的修宪主体,宪法修正案是我国宪法规定的宪法修改方式,A
59,下列选项中，可以适用不当得利主张请求权的情形是____。,甲为自己正在读大学的弟弟乙支付学费，后甲要求乙返还,丙明知不欠丁的钱而执意向丁还钱，后丙要求丁返还该金钱,张某偿还了欠李某的赌债，后张某要求李某返还赌资,陈某和吴某同在河边放牛，后陈某的一头牛走入吴某的牛群中，而吴某对此并不知情,D
60,刘婆婆回家途中，看见邻居肖婆婆带着外孙小勇和另一家邻居的孩子小囡(均为4岁多)在小区花园中玩耍，便上前拿出几根香蕉递给小勇，随后离去。小勇接过香蕉后，递给小囡一根，小囡吞食时误入气管导致休克，经抢救无效死亡。对此，下列哪一选项是正确的?____,刘婆婆应对小囡的死亡承担民事责任,肖婆婆应对小囡的死亡承担民事责任,小勇的父母应对小囡的死亡承担民事责任,属意外事件，不产生相关人员的过错责任,D
61,下列选项中，能够引起不当得利之债发生的是____。,为回赎绑票向绑匪交付赎金,为邻居垫支话费,冒名将他人稿酬取走,履行期限到来之前向债权人发货,A
62,甲、乙因生活琐事互相斗殴，乙感到不是甲的对手而逃跑。甲紧追不舍，乙逃出500米后被甲赶上。甲用木棍向乙头部猛击。情急之下，乙抽出随身携带的水果刀朝甲刺去，致甲重伤。乙的行为____。,构成故意杀人罪未遂,构成故意伤害罪,构成寻衅滋事罪,不构成犯罪,D
63,甲、乙是某高校住同一寝室的研究生，二人合用一台电脑。甲向美国某大学申请留美奖学金，并将此事告知乙。美方发出电子邮件，邀请甲赴美留学。恰巧甲不在，乙出于嫉妒，擅自发邮件拒绝美方邀请。数日后甲发电子邮件向美方询问，美方告知甲因其拒绝邀请而不再考虑。乙侵犯了甲的____。,姓名权,名誉权,名称权,隐私权,A
64,下列要素中，不能作为商标申请注册的是____。,商务标语,声音,字母,颜色组合,A
65,以牟利为目的，盗接他人通信线路、复制他人电信码号或者明知是盗接、复制的电信设备、设施而使用的，应构成____。,非法经营罪,侵占罪,盗窃罪,破坏公用电信设施罪,C
66,下列不属于告诉才处理的情形是____。,侵占罪,侮辱罪未严重危害社会秩序和国家利益的,虐待罪致使被害人重伤、死亡的,暴力干涉婚姻自由罪，未致使被害人死亡的,C
67,甲因盗窃罪案发被捕，在侦查人员对其审讯期间，甲交代了自己与乙在交通工具上抢劫3万元的犯罪事实，并协助侦查机关将乙抓获。对甲的抢劫罪____。,可以从轻或者减轻处罚,可以减轻或者免除处罚,可以免除处罚,应当减轻或者免除处罚,D
68,在下列犯罪形态中，适用“从一重处断”原则予以论处的是____。,结果加重犯,继续犯,想象竞合犯,吸收犯,C
69,下列选项中，属于无因行为的是____。,出售房屋,汇票的出票,赠与电脑,继承遗产,B
70,与《大清律例》相比，《大清现行刑律》的变化不包括____。,取消了六部分篇的法典编纂体例,删除了“十恶”重罪等内容,对于婚姻、继承、田宅、钱债等纯属民事性质的行为不再科刑,增加了一些新罪名，诸如妨害国交罪、妨害选举罪、私铸银元罪等,B
71,《刑法》第115条第2款规定“过失犯前款罪的……”，属于____。,简单罪状,叙明罪状,空白罪状,引证罪状,D
72,下列选项中，属于代理情形的是____。,甲委托乙把自己的孩子从幼儿园接回来,丙接受丁的委托，以丁的名义与戊签订买卖合同,赵某接受钱某的委托，将钱某不接受缔约要求的意思表示向孙某作了回复,远大公司由法定代表人李某与宏远公司法定代表人周某签订加工承揽合同,B
73,甲、乙、丙三人分别出资30万元、30万元、40万元购买重型货车一辆，从事长途运输。三人约定：甲负责驾驶，乙负责对车管理维护，而丙负责招揽业务，且3年内不得分割共有物。三人对其他事项未作约定。甲、丙二人未经乙的同意，擅自签订抵押合同将该车抵押给不知情的丁，并办理了抵押登记。后来，甲因疲劳驾驶发生事故，造成行人戊受伤。对此，下列说法正确的是____。,甲、乙、丙对于货车享有的权利份额，应当按照出资额确定,戊只能要求甲赔偿损失,丁善意取得货车的抵押权,甲、乙、丙可以随时请求分割共有物,A
74,幼儿园教师甲在幼儿园卫生间多次用针刺戳肖某等10余名幼儿的臀部，虽未造成伤害后果，但情节十分恶劣。甲的行为应认定为____。,侮辱罪,猥亵儿童罪,虐待被监护、看护人罪,故意伤害罪,C
75,下列关于我国刑法中罪刑法定原则的理解，正确的是____。,简单罪状因缺乏明确性不符合罪刑法定原则,将习惯法视为刑法的渊源不违反罪刑法定原则,罪刑法定原则不允许有利于被告人的新法溯及既往,罪刑法定原则中的“法”不包括行政法规,D
76,甲、乙同为儿童玩具生产商。六一节前夕，丙与甲商谈进货事宜。乙知道后向丙提出更优惠条件，并指使丁假借订货与甲接洽，报价高于丙以阻止甲与丙签约。丙经比较与乙签约，丁随即终止与甲的谈判，甲因此遭受损失。对此，下列哪一说法是正确的?____,乙应对甲承担缔约过失责任,丙应对甲承担缔约过失责任,丁应对甲承担缔约过失责任,乙、丙、丁无须对甲承担缔约过失责任,C
77,甲将其对乙享有的10万元货款债权转让给丙，丙再转让给丁，乙均不知情。乙将债务转让给戊，得到了甲的同意。丁要求乙履行债务，乙以其不知情为由抗辩。下列哪一表述是正确的?____,甲将债权转让给丙的行为无效,丙将债权转让给丁的行为无效,乙将债务转让给戊的行为无效,如乙清偿10万元债务，则享有对戊的求偿权,D
78,伪证罪只能发生在____。,立案侦查以前,起诉之后,立案、侦查、起诉和审判过程中,判决宣告以后,C
79,英语名词“lab”(实验室)原来的形式是“laboratory”，这在词的形成方式上属于____。,直接成词,变形成词,变性成词,逆序成词,D
80,音位是____。,最小的语音语义结合体,一个语音系统中能区别意义的最小语音单位,语言中最小的能区别意义的语音特征单位,语言中有区别性特征的最小语音单位,B
81,下列语言中，属于印欧语系拉丁语族的语言是____。,英语,俄语,德语,法语,D
82,《史记·高祖本纪》：“今则来，沛公恐不得有此。”句中“则”的用法是____。,表示承接,表示转折,表示假设,表示因果,C
83,《四世同堂》中的冠晓荷是____。,老派市民的形象,革命者的形象,正直的知识分子形象,民族败类的形象,D
84,“塑”这个字的音节的声母是____。,sh,x,s,零声母,C
85,《论语·述而》：“若圣与仁，则吾岂敢?抑为之不厌，诲人不倦，则可谓云尔已矣。”句中“抑”的用法是____。,表示假设,表示转折,表示原因,表示目的,B
86,下列有歧义的一项是____。,进口汽车,路边种着树,洗得干净,咬死了猎人的鸡,D
87,[p][p‘][b][m]四个音素的区别主要是____。,清浊,发音方法,发音部位,送气与否,A
88,____是中国古代蒙学教育所采用的一种识字课本，由周兴嗣编撰而成。,《三字经》,《弟子规》,《百家姓》,《千字文》,D
89,卢舍那大佛是石窟雕塑中____的代表作。,云冈石窟,龙门石窟,莫高窟,麦积山石窟,B
90,目前最通用的楷书印刷体是____。,宋体,仿宋体,楷体,黑体,A
91,下列句中，不属于宾语前置的是____。,姜氏何厌之有?,斥鷃笑之曰：“彼且奚适也?”,居则曰：“不吾知也!”,胡不见我于王?,D
92,“员、可、乡、分、展、从”中包含的自由语素是____。,乡、分、从,可、分、展,员、乡、分,员、可、乡,A
93,《杜十娘怒沉百宝箱》出自____。,《传奇》,《聊斋志异》,“三言”,“二拍”,C
94,剧作家____被誉为“中国十六世纪的莎士比亚”。,关汉卿,白朴,汤显祖,马致远,C
95,《三国志·蜀书·诸葛亮传》：“每自比于管仲、乐毅，时人莫之许也。”句中“于”的用法是____。,表对象,表比较,表原因,表施事,A
96,《本草纲目》的作者是____李时珍。,南宋人,明朝人,元朝人,清朝人,B
97,“我、你、他”是____。,指示代词,疑问代词,人称代词,名词,C
98,关于词的本义和基本义的关系，下列表述正确的是____。,完全不一致,完全一致,本义比基本义更常用,基本义比本义更常用,D
99,“现在轮到你说了”是____。,连谓句,兼语句,被动句,双宾语句,B
100,“队”与“坠”是____。,古今字,异体字,通假字,繁简字,A
101,d、t、n、l四个辅声的发音部位是____。,舌尖前,舌面,舌尖中,舌尖后,C
102,当$x=-3$ 时，下列分式无意义的是____,$\frac{x-3}{x}$,$\frac{x+3}{x}$,$\frac{x}{x-3}$,$\frac{x}{x+3}$,D
103,如果 $x=3$是关于 x的$2x+m=7$方程 的解，那么 $m$的值为____,-1,2,1,-2,C
104,⊙O是一个正n边形的外接圆，若⊙O的半径与这个正n边形的边长相等，则n的值为____,3,4,5,6,D
105,下列等式变形错误的是 ____,"若$a=b$,则$3a-1=3b-1$","若$a=b$,则$a c^{2}=b c^{2}$","若$\frac{a}{c^{2}}=\frac{b}{c^{2}}$,则$a =b $","若$a c^{2}=b c^{2}$,则$a=b$",D
106,“垃圾分类”已经在全国开展得如火如荼，某回收公司有四包可回收垃圾，每包以标准克数（ 千克）为基准，超过的千克数记作正数，不足的千克数记作负数，以下数据是记录结果，其中表示实际重量最接近标准千克数的是 ____,-1,2,-0.5,0,D
107,某施工队承接了60公里的修路任务，为了提前完成任务，实际每天的工作效率比原计划提高了25％，结果提前60天完成了这项任务．设原计划每天修路x公里，根据题意列出的方程正确的是____,$\frac{60\times (1+25 \%)}{x} -\frac{60}{x}=60$,$\frac{60}{x}-\frac{60\times (1+25 \%)}{x} =60$,$\frac{60 }{ (1+25 \%)x} -\frac{60}{x}=60$,$ \frac{60}{x}-\frac{60 }{ (1+25 \%)x} =60$,D
108,线段$AB=9$ ，点C在线段$AB$上，且有$AC=\frac{1}{3}AB$ ， M是AB 的中点，则 MC等于____,$3$,$\frac{3}{2}$,$\frac{9}{2}$,$\frac{15}{2}$,B
109,下列命题正确的是____,三角形的重心是三条高线的交点,等腰三角形底边上的中线不一定垂直于底边,线段垂直平分线上的点到线段两端的距离相等,含根号的数都是无理数,C
110,下列各组代数式中为同类项的是____,$-2xy$与$2x$,$5x^2y$与$-2xy^2$,$5x^5y^4$与$-5x^5z^4$,$-xy$与$\frac{3}{2}y x$,D
